### ISSUE TITLE
Can't send packets longer than 124 bytes between two RF24GatewayNodes (RPi)

### ISSUE THREAD

**Issue by lukolszewski** [TMRh20/RF24Gateway#20]
I would like to use RF24 for an IP link between two raspberry PIs (3B). I configured MAX_PAYLOAD_SIZE to 1514 in RF24Network_Config.h. I then set one node with its mesh id of 3 and last octet of its IP matching. The other node has mesh id of zero and its last octet of IP is 2. With the examples/RF24GatewayNode running I can ping between those two devices.

However, when I try to ping using more that 116 bytes as payload the remaining bytes are truncated. Same for TCP and UDP. Here is an example tcpdump capture of the tun interface showing missing byte with packets over 124 bytes.

 sudo tcpdump -i tun_nrf24
tcpdump: verbose output suppressed, use -v[v]... for full protocol decode
listening on tun_nrf24, link-type RAW (Raw IP), snapshot length 262144 bytes
00:23:41.490684 IP 10.10.2.3 > 10.10.2.2: ICMP echo request, id 33, seq 1, length 124
00:23:41.490785 IP 10.10.2.2 > 10.10.2.3: ICMP echo reply, id 33, seq 1, length 124
00:23:42.489425 IP 10.10.2.3 > 10.10.2.2: ICMP echo request, id 33, seq 2, length 124
00:23:42.489527 IP 10.10.2.2 > 10.10.2.3: ICMP echo reply, id 33, seq 2, length 124
00:23:53.207961 IP truncated-ip - 1 bytes missing! 10.10.2.3 > 10.10.2.2: ICMP echo request, id 34, seq 1, length 125
00:23:54.221755 IP truncated-ip - 1 bytes missing! 10.10.2.3 > 10.10.2.2: ICMP echo request, id 34, seq 2, length 125

Please let me know if there is something else I can do for the MTU of 1500 to work.

**Comment by lukolszewski** [comment]
I didn't notice the first MAX_PAYLOAD_SIZE in the RFNetwork_Config.h was ifdef'ed for Attiny only and there was another definition for all other platforms below. After I changed the value in the remaining place it works now.
